{
  "$schema": "../schema.json",
  "includes": [
    "../common/common.json",
    "../common/player_inventory.json",
    "../common/switch_toolbox.json"
  ],
  "background": {
    "texture": "guis/megacells/mega_pattern_provider.png",
    "srcRect": [
      0,
      0,
      176,
      213
    ]
  },
  "slots": {
    "ENCODED_PATTERN": {
      "left": 8,
      "top": 45,
      "grid": "BREAK_AFTER_9COLS"
    },
    "STORAGE": {
      "left": 8,
      "top": 97,
      "grid": "HORIZONTAL"
    }
  },
  "text": {
    "dialog_title": {
      "text": {
        "translate": "block.megacells.mega_pattern_provider"
      },
      "position": {
        "left": 8,
        "top": 6
      }
    },
    "interface_config": {
      "text": {
        "translate": "gui.ae2.Patterns"
      },
      "position": {
        "left": 8,
        "top": 34
      }
    },
    "interface_stored_items": {
      "text": {
        "translate": "gui.ae2.ReturnInventory"
      },
      "position": {
        "left": 8,
        "top": 86
      }
    }
  },
  "widgets": {
    "openPriority": {
      "left": 154,
      "top": 0
    },
    "lockReason": {
      "left": 5,
      "top": 15
    }
  }
}