{
  "$schema": "schema.json",
  "includes": [
    "common/common.json"
  ],
  "text": {
    "dialog_title": {
      "text": {
        "translate": "gui.advanced_ae.QuantumArmorSetting"
      },
      "position": {
        "left": 4,
        "top": 4
      }
    }
  },
  "background": {
    "texture": "guis/quantum_armor_setting_config.png",
    "srcRect": [
      0,
      0,
      99,
      78
    ]
  },
  "widgets": {
    "back": {
      "left": 77,
      "top": 0
    },
    "slider": {
      "left": 15,
      "top": 32,
      "width": 71,
      "height": 20
    },
    "colorPicker": {
      "left": 15,
      "top": 0,
      "width": 71,
      "height": 50
    }
  }
}
