{
  "$schema": "../schema.json",
  "includes": [
    "../common/common.json",
    "../common/player_inventory.json",
    "../common/terminal_switch_toolbox.json"
  ],
  "helpTopic": "items-blocks-machines/terminals.md#pattern-access-terminal-ui",
  "text": {
    "dialog_title": {
      "text": {
        "translate": "ae2.gto_extension.facility_management_short"
      },
      "position": {
        "left": 8,
        "top": 6
      }
    }
  },
  "widgets": {
    "scrollbar": {
      "left": 176,
      "top": 42
    },
    "search": {
      "left": 7,
      "top": 25,
      "width": 112,
      "height": 14
    },
    "filter1": {
      "right": 67,
      "top": 13
    },
    "filter2": {
      "right": 44,
      "top": 13
    }
  },
  "slots": {
    "PLAYER_INVENTORY": {
      "left": 8,
      "bottom": 82,
      "grid": "BREAK_AFTER_9COLS"
    },
    "PLAYER_HOTBAR": {
      "left": 8,
      "bottom": 24,
      "grid": "HORIZONTAL"
    }
  }
}
