{
  "$schema": "../schema.json",
  "includes": [
    "../common/common.json",
    "../common/player_inventory.json"
  ],
  "helpTopic": "items-blocks-machines/terminals.md#pattern-access-terminal-ui",
  "text": {
    "dialog_title": {
      "text": {
        "translate": "gui.ae2.PatternAccessTerminalShort"
      },
      "position": {
        "left": 8,
        "top": 6
      }
    }
  },
  "widgets": {
    "scrollbar": {
      "left": 175,
      "top": 18
    },
    "search": {
      "left": 104,
      "top": 4,
      "width": 65,
      "height": 12
    }
  }
}